{
  "$schema": "https://json-schema.org/draft/2020-12/schema",
  "$id": "https://jscene3d.org/schemas/scene-definition-1.json",
  "title": "JScene3D Scene Definition version 1",
  "type": "object",
  "additionalProperties": false,
  "required": ["assetId", "assetType", "formatVersion", "name", "connections", "roots"],
  "properties": {
    "$schema": {"type": "string", "format": "uri"},
    "assetId": {"type": "string", "format": "uuid"},
    "assetType": {"const": "scene-definition"},
    "formatVersion": {"const": 1},
    "name": {"type": "string", "minLength": 1},
    "connections": {
      "type": "array",
      "items": {"$ref": "entity-definition-1.schema.json#/$defs/connection"}
    },
    "roots": {
      "type": "array",
      "items": {"$ref": "entity-definition-1.schema.json#/$defs/entry"}
    }
  }
}
