{
  "$schema": "https://jscene3d.org/schemas/scene-definition-1.json",
  "assetId": "747a501f-65ca-492f-92d8-6a0711c8d7a5",
  "assetType": "scene-definition",
  "formatVersion": 1,
  "name": "Second",
  "connections": [],
  "roots": [
    {
      "entryType": "local",
      "entityId": "a15d62b9-c6a2-4d28-9d3a-68cc594efa05",
      "name": "Sphere",
      "enabled": true,
      "components": [
        {
          "componentId": "af99c972-57c0-4e41-8415-619123b4ff21",
          "type": "io.github.glynch.jscene3d.spatial3d/transform-3d",
          "typeVersion": 1,
          "properties": {
            "position": [0.75, 1, -0.75],
            "scale": [1.25, 1.25, 1.25]
          }
        },
        {
          "componentId": "d9d0b7d9-f875-4efd-ac4a-1be83f4ee292",
          "type": "io.github.glynch.jscene3d.spatial3d/mesh-renderer-3d",
          "typeVersion": 1,
          "properties": {
            "mesh": {
              "$ref": "asset:sandbox-sphere-mesh"
            },
            "material": {
              "$ref": "asset:sandbox-sphere-material"
            },
            "visible": true
          }
        }
      ],
      "children": []
    },
    {
      "entryType": "local",
      "entityId": "db11f2a8-babe-4643-95ec-e78a0da201f9",
      "name": "Directional Light",
      "enabled": true,
      "components": [
        {
          "componentId": "92ae4dfb-95d7-4e98-926f-67289f3807d1",
          "type": "io.github.glynch.jscene3d.spatial3d/transform-3d",
          "typeVersion": 1,
          "properties": {
            "position": [-4, 5, 3]
          }
        },
        {
          "componentId": "7d11580a-c96f-4273-99f1-cd2e62eec05e",
          "type": "io.github.glynch.jscene3d.spatial3d/directional-light-3d",
          "typeVersion": 1,
          "properties": {
            "color": [0.75, 0.9, 1],
            "intensity": 2.5,
            "target": [0.75, 1, -0.75]
          }
        }
      ],
      "children": []
    }
  ]
}
